{
  "book": {
    "articles": [
      {
        "post": {
          "id": "alamori-story",
          "paragraphs": [
            {
              "en": "Alamori does not begin with a grand mission. Harvey is looking for old sources for a university project about Atlantis. A book he finds in the archive of St. Michel Library changes the direction of that ordinary search.",
              "tr": "Alamori'nin başlangıcında büyük bir görev yok. Harvey, Atlantis hakkında hazırladığı üniversite projesi için eski kaynakları araştırıyor. St. Michel Kütüphanesi'nin arşivinde karşılaştığı bir kitap, bu gündelik arayışı başka bir yöne çeviriyor."
            },
            {
              "en": "This introduction is not meant to give every answer away. The preview is a way to meet the narrator's voice, Harvey and Mike's friendship, and the curiosity the book awakens.",
              "tr": "Hikâyeye açılan bu sayfada bütün cevapları vermek istemiyorum. Önizleme; anlatıcının sesiyle, Harvey ve Mike'ın ilişkisiyle ve kitabın uyandırdığı merakla tanışmak için bir başlangıç."
            },
            {
              "en": "The novel is still being written. The first 20 pages are the opening preview; writing notes and further updates will follow as work continues.",
              "tr": "Romanın yazımı sürüyor. Şimdilik ilk 20 sayfa paylaşılacak; ilerledikçe buraya yazım notları ve yeni güncellemeler eklenecek."
            }
          ],
          "published": "2026-10-23"
        },
        "summary": {
          "en": "A short opening note about a library, an old book and following a question.",
          "tr": "Bir kütüphane, eski bir kitap ve merakın peşinden gitmek üzerine kısa bir başlangıç notu."
        },
        "title": {
          "en": "What kind of story is Alamori?",
          "tr": "Alamori nasıl bir hikâye?"
        },
        "url": {
          "en": "writing/alamori-story-en/",
          "tr": "tr/writing/alamori-story-tr/"
        }
      },
      {
        "post": {
          "id": "alamori-writing",
          "paragraphs": [
            {
              "en": "Finishing a chapter does not mean I am done with it. When rereading, I look at sentence rhythm, what each character knows and what a scene leaves for the one that follows.",
              "tr": "Bir bölümü bitirmek, onunla işimin bittiği anlamına gelmiyor. Yeniden okurken cümlelerin ritmine, karakterlerin ne bildiğine ve bir sahnenin sonraki sahneye ne bıraktığına bakıyorum."
            },
            {
              "en": "Alamori's Turkish text and English translation develop together. Preserving the narrator's voice and intentional uncertainty matters alongside carrying the same events into both languages.",
              "tr": "Alamori'nin Türkçe metni ve İngilizce çevirisi birlikte gelişiyor. İki dilde aynı olayları aktarmak kadar anlatıcının sesini ve bilinçli bırakılan belirsizlikleri korumak da önemli."
            },
            {
              "en": "The roadmap is not a promise of a publication date. It is a way to show the current work and the next reading. If you try the preview, I would especially like to hear where it caught your curiosity or where it lost you.",
              "tr": "Yol haritası bir yayın tarihi sözü değil. Şu anki işi ve sıradaki okumayı görünür kılmanın bir yolu. Önizlemeyi okursan, özellikle nerede meraklandığını veya nerede metinden uzaklaştığını duymak isterim."
            }
          ],
          "published": "2026-10-23"
        },
        "summary": {
          "en": "Scene rhythm, working in two languages and preparing for another reading.",
          "tr": "Sahne ritmi, iki dilde çalışma ve bir sonraki okumaya hazırlık."
        },
        "title": {
          "en": "From the writing desk: what I am working on",
          "tr": "Yazım masasından: neler üzerinde çalışıyorum?"
        },
        "url": {
          "en": "writing/alamori-writing-en/",
          "tr": "tr/writing/alamori-writing-tr/"
        }
      }
    ],
    "author": "Mehmet Berk Gürçay",
    "covers": {
      "en": {
        "alt": {
          "en": "Cover of Alamori: Passage to Atlantis, English edition",
          "tr": "Alamori: Passage to Atlantis İngilizce kitap kapağı"
        },
        "height": 1536,
        "src": "media/alamori/921e48c5ca57ff94ca81f47703ead036e25c1ae91cda60454c000aa5ce3e06cb.jpg",
        "width": 1024
      },
      "tr": {
        "alt": {
          "en": "Cover of Alamori: Passage to Atlantis, Turkish edition",
          "tr": "Alamori: Atlantis'e Açılan Kapı kitap kapağı"
        },
        "height": 1536,
        "src": "media/alamori/339a239ea3e1302c68d2823f5c12dba0b4b5c014ea5a3fc9c0e14e2aa533cc77.jpg",
        "width": 1024
      }
    },
    "currentFocus": {
      "en": "I am working on the continuing story while refining the language, rhythm and continuity of the existing chapters.",
      "tr": "Hikâyenin devamını yazarken mevcut bölümlerin dili, ritmi ve sürekliliği üzerinde çalışıyorum."
    },
    "facts": [
      {
        "label": {
          "en": "Genre",
          "tr": "Tür"
        },
        "value": {
          "en": "Science fiction / Adventure",
          "tr": "Bilimkurgu / Macera"
        }
      },
      {
        "label": {
          "en": "Languages",
          "tr": "Diller"
        },
        "value": {
          "en": "Turkish and English",
          "tr": "Türkçe ve İngilizce"
        }
      },
      {
        "label": {
          "en": "Format",
          "tr": "Biçim"
        },
        "value": {
          "en": "Novel",
          "tr": "Roman"
        }
      }
    ],
    "feedback": {
      "description": {
        "en": "Which scene stayed with you? Where were you curious, and where did you hesitate? You can share a short reader note by email.",
        "tr": "Hangi sahne aklında kaldı? Nerede meraklandın, nerede duraksadın? Kısa bir okur notunu e-postayla paylaşabilirsin."
      },
      "title": {
        "en": "Let's talk after you read",
        "tr": "Okuduktan sonra konuşalım"
      },
      "url": {
        "en": "mailto:mbgurcay@gmail.com?subject=Alamori%20-%20Reader%20note",
        "tr": "mailto:mbgurcay@gmail.com?subject=Alamori%20-%20Okur%20notu"
      }
    },
    "genres": [
      {
        "en": "Science fiction",
        "tr": "Bilimkurgu"
      },
      {
        "en": "Adventure",
        "tr": "Macera"
      }
    ],
    "id": "alamori",
    "previews": [
      {
        "language": "tr",
        "pages": 20,
        "src": "media/alamori/2c850c2d725306c07e5307377ee461146418e1f9d5820fcaabb745f2aff92b4f.pdf",
        "updatedAt": "2026-10-23"
      },
      {
        "language": "en",
        "pages": 20,
        "src": "media/alamori/7a5a6a1696130dad77fb634d5e5b0d55ab63c2df427fda8cb386072ae2a143f4.pdf",
        "updatedAt": "2026-10-23"
      }
    ],
    "roadmap": [
      {
        "body": {
          "en": "The world, characters and opening chapters are written; the Turkish text and English translation are developing together.",
          "tr": "Dünya, karakterler ve ilk bölümler yazıldı; Türkçe metinle İngilizce çeviri birlikte ilerliyor."
        },
        "state": "done",
        "title": {
          "en": "The story's foundations",
          "tr": "Hikâyenin temelleri"
        }
      },
      {
        "body": {
          "en": "Writing new chapters, rereading existing scenes and keeping the narrative coherent.",
          "tr": "Yeni bölümleri yazmak, mevcut sahneleri yeniden okumak ve anlatının bütünlüğünü korumak."
        },
        "state": "current",
        "title": {
          "en": "Writing and rereading",
          "tr": "Yazım ve yeniden okuma"
        }
      },
      {
        "body": {
          "en": "Gathering responses to the preview and revisiting the text with those readings in mind.",
          "tr": "Önizleme hakkındaki düşünceleri toplamak ve metni bu okumalarla yeniden değerlendirmek."
        },
        "state": "next",
        "title": {
          "en": "Reader notes and the next revision",
          "tr": "Okur notları ve sonraki düzenleme"
        }
      }
    ],
    "status": "writing",
    "statusNote": {
      "en": "Writing and revision are ongoing. A publication date has not been announced.",
      "tr": "Romanın yazımı ve düzenlemesi sürüyor. Yayın tarihi henüz açıklanmadı."
    },
    "subtitle": {
      "en": "Passage to Atlantis",
      "tr": "Atlantis'e Açılan Kapı"
    },
    "synopsis": [
      {
        "en": "Harvey's university project on Atlantis takes a turn when he discovers a book in the old archive of St. Michel Library. An unfamiliar language, recurring drawings of a city, and one word: Alamori.",
        "tr": "Harvey'nin Atlantis hakkında hazırladığı üniversite projesi, St. Michel Kütüphanesi'nin eski arşivinde bulduğu bir kitapla yön değiştirir. Tanımadığı bir dil, tekrar eden şehir çizimleri ve tek bir kelime: Alamori."
      },
      {
        "en": "As he and his friend Mike follow the pages, their curiosity becomes part of a secret that grows harder to keep. Alamori is a science-fiction adventure about the pull of the unknown and the decisions people make together.",
        "tr": "Arkadaşı Mike'la birlikte sayfaların peşine düşerken, merakları giderek saklaması zor bir sırrın parçasına dönüşür. Alamori, bilinmeyene duyulan merakın ve birlikte alınan kararların izini süren bir bilimkurgu ve macera romanı."
      }
    ],
    "tagline": {
      "en": "Some books tell a story. Others open a door.",
      "tr": "Bazı kitaplar bir hikâye anlatır. Bazılarıysa bir kapı açar."
    },
    "title": "Alamori",
    "updatedAt": "2026-10-23",
    "updates": [
      {
        "body": {
          "en": "The first 20 pages are being prepared as Turkish and English reading previews. This page brings together the story introduction, selected writing notes and the next steps.",